{
  "directory_errors": [],
  "exclusion_policy_version": "1.5.0",
  "files": [
    {
      "alternating_nul_evidence": {
        "alternating": false,
        "dominant_parity_ratio": 0.0,
        "even_position_nuls": 0,
        "odd_position_nuls": 0
      },
      "byte_order_mark": null,
      "classes_structs_status": "complete",
      "content_hash": "c3feab0ef7dbdd9bf0ac2c1fc21e235aa47b3c22042f3e1024eeb9907736da67",
      "content_type": null,
      "detected_encoding": "utf-8",
      "detected_language": "Python",
      "encoding_error": null,
      "encoding_transformation_applied": null,
      "error_category": null,
      "exclusion_reason": null,
      "extension": ".py",
      "filename": "__init__.py",
      "git_mode": "100644",
      "git_symlink_target": null,
      "git_symlink_target_exists": null,
      "included_in_metrics": true,
      "is_build_output": false,
      "is_configuration": false,
      "is_declaration_only": false,
      "is_dependency": false,
      "is_generated": false,
      "is_git_submodule": false,
      "is_git_symlink": false,
      "is_infrastructure": false,
      "is_minified_or_bundled": false,
      "is_source": true,
      "is_test": false,
      "is_vendor": false,
      "line_ending_style": "lf",
      "loc_status": "complete",
      "malformed_nodes": [],
      "methods_functions_status": "complete",
      "nul_classification": null,
      "nul_contexts": [],
      "nul_count": 0,
      "nul_density": 0.0,
      "nul_positions": [],
      "original_byte_length": 359,
      "original_byte_offsets_available": true,
      "original_encoding": "utf-8",
      "oversized": false,
      "parse_error": null,
      "parse_status": "complete",
      "parser_byte_length": 359,
      "parser_byte_offset_adjustment": 0,
      "parser_compatibility_strategy": null,
      "parser_diagnostic": null,
      "parser_encoding": "utf-8",
      "parser_normalization_applied": false,
      "parser_offsets_map_directly_to_original_bytes": true,
      "read_error": null,
      "read_status": "complete",
      "relative_path": "services/__init__.py",
      "size_bytes": 359,
      "suspected_bomless_utf16": false,
      "template_evidence_category": null,
      "template_evidence_summary": null,
      "template_family": null,
      "typed_javascript_dialect_evidence": []
    },
    {
      "alternating_nul_evidence": {
        "alternating": false,
        "dominant_parity_ratio": 0.0,
        "even_position_nuls": 0,
        "odd_position_nuls": 0
      },
      "byte_order_mark": null,
      "classes_structs_status": "complete",
      "content_hash": "ec74117664238900a9ffaebc77b8f16eca02fbbad6d544d1668de9c3cbf4f4ef",
      "content_type": null,
      "detected_encoding": "utf-8",
      "detected_language": "Python",
      "encoding_error": null,
      "encoding_transformation_applied": null,
      "error_category": null,
      "exclusion_reason": null,
      "extension": ".py",
      "filename": "bookings.py",
      "git_mode": "100644",
      "git_symlink_target": null,
      "git_symlink_target_exists": null,
      "included_in_metrics": true,
      "is_build_output": false,
      "is_configuration": false,
      "is_declaration_only": false,
      "is_dependency": false,
      "is_generated": false,
      "is_git_submodule": false,
      "is_git_symlink": false,
      "is_infrastructure": false,
      "is_minified_or_bundled": false,
      "is_source": true,
      "is_test": false,
      "is_vendor": false,
      "line_ending_style": "lf",
      "loc_status": "complete",
      "malformed_nodes": [],
      "methods_functions_status": "complete",
      "nul_classification": null,
      "nul_contexts": [],
      "nul_count": 0,
      "nul_density": 0.0,
      "nul_positions": [],
      "original_byte_length": 801,
      "original_byte_offsets_available": true,
      "original_encoding": "utf-8",
      "oversized": false,
      "parse_error": null,
      "parse_status": "complete",
      "parser_byte_length": 801,
      "parser_byte_offset_adjustment": 0,
      "parser_compatibility_strategy": null,
      "parser_diagnostic": null,
      "parser_encoding": "utf-8",
      "parser_normalization_applied": false,
      "parser_offsets_map_directly_to_original_bytes": true,
      "read_error": null,
      "read_status": "complete",
      "relative_path": "services/bookings.py",
      "size_bytes": 801,
      "suspected_bomless_utf16": false,
      "template_evidence_category": null,
      "template_evidence_summary": null,
      "template_family": null,
      "typed_javascript_dialect_evidence": []
    },
    {
      "alternating_nul_evidence": {
        "alternating": false,
        "dominant_parity_ratio": 0.0,
        "even_position_nuls": 0,
        "odd_position_nuls": 0
      },
      "byte_order_mark": null,
      "classes_structs_status": "complete",
      "content_hash": "d3298021b39ecdb4a6083c2698ee946b111fbd47e3c3a7016b9b5e688426d0f0",
      "content_type": null,
      "detected_encoding": "utf-8",
      "detected_language": "Python",
      "encoding_error": null,
      "encoding_transformation_applied": null,
      "error_category": null,
      "exclusion_reason": null,
      "extension": ".py",
      "filename": "movies.py",
      "git_mode": "100644",
      "git_symlink_target": null,
      "git_symlink_target_exists": null,
      "included_in_metrics": true,
      "is_build_output": false,
      "is_configuration": false,
      "is_declaration_only": false,
      "is_dependency": false,
      "is_generated": false,
      "is_git_submodule": false,
      "is_git_symlink": false,
      "is_infrastructure": false,
      "is_minified_or_bundled": false,
      "is_source": true,
      "is_test": false,
      "is_vendor": false,
      "line_ending_style": "lf",
      "loc_status": "complete",
      "malformed_nodes": [],
      "methods_functions_status": "complete",
      "nul_classification": null,
      "nul_contexts": [],
      "nul_count": 0,
      "nul_density": 0.0,
      "nul_positions": [],
      "original_byte_length": 835,
      "original_byte_offsets_available": true,
      "original_encoding": "utf-8",
      "oversized": false,
      "parse_error": null,
      "parse_status": "complete",
      "parser_byte_length": 835,
      "parser_byte_offset_adjustment": 0,
      "parser_compatibility_strategy": null,
      "parser_diagnostic": null,
      "parser_encoding": "utf-8",
      "parser_normalization_applied": false,
      "parser_offsets_map_directly_to_original_bytes": true,
      "read_error": null,
      "read_status": "complete",
      "relative_path": "services/movies.py",
      "size_bytes": 835,
      "suspected_bomless_utf16": false,
      "template_evidence_category": null,
      "template_evidence_summary": null,
      "template_family": null,
      "typed_javascript_dialect_evidence": []
    },
    {
      "alternating_nul_evidence": {
        "alternating": false,
        "dominant_parity_ratio": 0.0,
        "even_position_nuls": 0,
        "odd_position_nuls": 0
      },
      "byte_order_mark": null,
      "classes_structs_status": "failed",
      "content_hash": "9c5b52a548c7da523e7fcabcfb4ea398208ed9b4aa0aaadb45088163dc0a5303",
      "content_type": null,
      "detected_encoding": "utf-8",
      "detected_language": "Python",
      "encoding_error": null,
      "encoding_transformation_applied": null,
      "error_category": "unsupported_language_version",
      "exclusion_reason": null,
      "extension": ".py",
      "filename": "showtimes.py",
      "git_mode": "100644",
      "git_symlink_target": null,
      "git_symlink_target_exists": null,
      "included_in_metrics": true,
      "is_build_output": false,
      "is_configuration": false,
      "is_declaration_only": false,
      "is_dependency": false,
      "is_generated": false,
      "is_git_submodule": false,
      "is_git_symlink": false,
      "is_infrastructure": false,
      "is_minified_or_bundled": false,
      "is_source": true,
      "is_test": false,
      "is_vendor": false,
      "line_ending_style": "lf",
      "loc_status": "complete",
      "malformed_nodes": [
        {
          "end_byte": 718,
          "end_column": 25,
          "end_line": 33,
          "malformed_node_type": "SyntaxError",
          "node_type": "SyntaxError",
          "original_end_byte": 718,
          "original_start_byte": 697,
          "parser_end_byte": 718,
          "parser_start_byte": 697,
          "start_byte": 697,
          "start_column": 4,
          "start_line": 33
        }
      ],
      "methods_functions_status": "failed",
      "nul_classification": null,
      "nul_contexts": [],
      "nul_count": 0,
      "nul_density": 0.0,
      "nul_positions": [],
      "original_byte_length": 820,
      "original_byte_offsets_available": true,
      "original_encoding": "utf-8",
      "oversized": false,
      "parse_error": "Python syntax error at line 33: Missing parentheses in call to 'print'. Did you mean print(...)?",
      "parse_status": "failed",
      "parser_byte_length": 820,
      "parser_byte_offset_adjustment": 0,
      "parser_compatibility_strategy": null,
      "parser_diagnostic": {
        "affected_metrics": [
          "classes_structs",
          "methods_functions"
        ],
        "alternating_nul_evidence": {
          "alternating": false,
          "dominant_parity_ratio": 0.0,
          "even_position_nuls": 0,
          "odd_position_nuls": 0
        },
        "analyzed_commit_sha": "c9d4770a6e2b5a6db7656f6b3c0bee320c7fe71b",
        "detected_language": "Python",
        "encoding_transformation_applied": null,
        "error_category": "unsupported_language_version",
        "extension": ".py",
        "fallback_attempted": false,
        "fallback_error_count": null,
        "fallback_grammar": null,
        "fallback_missing_count": null,
        "fallback_offsets_match_original": true,
        "fallback_strategies": [],